{
  "schema": "zen3-benchmark-addendum-v3",
  "protocol": {
    "id": "zen3-benchmark-protocol",
    "version": 3
  },
  "family": {
    "id": "nr-llr-derate-matching-baselines",
    "issue": "eda07788",
    "purpose": "consumer-family",
    "description": "Confirmatory comparator-gap baselines for 5G NR LDPC LLR de-rate-matching: gf2 Nr5gRateMatchedCode::prepare_llrs against AFF3CT v4.7.0 Puncturer_5G::depuncture behind a whole-consumer adapter (float conversion, zeroed output, filler normalization, conversion back to Vec<Llr>), on configurations that passed the committed equivalence gate. Six cells: BG2 at Z=22 and Z=52 with fillers and Z=72 without, BG1 at Z=96 with fillers and Z=48 without, and the portable-versus-native gf2 scalar/compiler control at BG1 Z=96. The arms, seeds, warm-cache method, conversion-inclusive boundary and 1.10/1.20 margins are the pilot's. This baseline survey proposes no production adoption."
  },
  "frozen": {
    "frozen_utc": "2026-09-10T17:09:28Z"
  },
  "effect": {
    "worthwhile_speedup": null,
    "rationale": "Comparator-gap cells only. This issue is a baseline survey: it proposes no production change, so no worthwhile-speedup threshold applies and none is declared.",
    "measurement_resolution": 0.03,
    "resolution_evidence": {
      "receipt": "dev/bench_results/eda07788/2026-09-10-eda07788-nr-derate-pilot/receipt.json",
      "sha256": "8843eeab9b4d95d2740658973c7e0c9b0dafadbbabe645b0743ec94c4797c713"
    },
    "equivalence_margin": 1.1,
    "equivalence_rationale": "A 10% equivalence margin. The declared 0.03 resolution is the larger of the widest conservative relative bootstrap half-width (0.025312) and the largest P-20 endpoint shift (0.017717) that the same-family 24-pair pilot shows when its raw pairs are bootstrapped at this confirmation's corrected alpha of 0.025/6, rounded up to two decimals (dev/active/eda07788/pilot-resolution-nr-derate.txt). It exceeds the pilot's own-alpha widest half-width of 0.007809, and this margin strictly clears one plus the resolution.",
    "material_gap_threshold": 1.2,
    "material_gap_rationale": "A 20% whole-consumer wall-clock gap is the smallest gap between two arms of this operation worth attributing to representation conversion, output initialization, per-call dispatch or scatter code generation rather than host noise. It strictly clears the same-family pilot resolution of 0.03."
  },
  "complexity_budget": {
    "max_new_unsafe_kernels": 0,
    "max_added_source_lines": 0,
    "maintenance_rationale": "A survey adopts nothing. No production kernel changes, so the budget is zero by construction; the whole diff is under dev/."
  },
  "family_wise": {
    "alpha": 0.05,
    "prior_confirmatory_trials": 0,
    "prior_trials": [],
    "ledger_path": "dev/active/eda07788/nr-llr-derate-matching-trial-ledger.jsonl"
  },
  "search_budget": {
    "max_pilot_trials_per_cell": 2,
    "max_confirmatory_attempts_per_candidate": 1
  },
  "holdout": {
    "required": false,
    "cells": []
  },
  "cells": [
    {
      "cell_id": "nr-bg2-n256-k121-gap-native-vs-aff3ct",
      "objective": "comparator-gap",
      "role": "confirmatory",
      "workload": {
        "identity": "nr-llr-derate-bg2-n256-k121",
        "size": {
          "base_graph": 2,
          "target_n": 256,
          "target_k": 121,
          "lifting": 22,
          "full_n": 1144,
          "fillers": 99
        },
        "seed": 301
      },
      "metric_kind": "whole-consumer",
      "scaling": "single-core-latency",
      "core_arm": "single-core",
      "workers": {
        "declared": 1,
        "nested_pools_allowed": false
      },
      "cache_state": "warm",
      "builds": {
        "baseline": "native",
        "candidate": "external"
      },
      "conversion_costs_included": true,
      "decoder": null
    },
    {
      "cell_id": "nr-bg2-n1024-k400-gap-native-vs-aff3ct",
      "objective": "comparator-gap",
      "role": "confirmatory",
      "workload": {
        "identity": "nr-llr-derate-bg2-n1024-k400",
        "size": {
          "base_graph": 2,
          "target_n": 1024,
          "target_k": 400,
          "lifting": 52,
          "full_n": 2704,
          "fillers": 120
        },
        "seed": 302
      },
      "metric_kind": "whole-consumer",
      "scaling": "single-core-latency",
      "core_arm": "single-core",
      "workers": {
        "declared": 1,
        "nested_pools_allowed": false
      },
      "cache_state": "warm",
      "builds": {
        "baseline": "native",
        "candidate": "external"
      },
      "conversion_costs_included": true,
      "decoder": null
    },
    {
      "cell_id": "nr-bg2-n1440-k720-gap-native-vs-aff3ct",
      "objective": "comparator-gap",
      "role": "confirmatory",
      "workload": {
        "identity": "nr-llr-derate-bg2-n1440-k720",
        "size": {
          "base_graph": 2,
          "target_n": 1440,
          "target_k": 720,
          "lifting": 72,
          "full_n": 3744,
          "fillers": 0
        },
        "seed": 303
      },
      "metric_kind": "whole-consumer",
      "scaling": "single-core-latency",
      "core_arm": "single-core",
      "workers": {
        "declared": 1,
        "nested_pools_allowed": false
      },
      "cache_state": "warm",
      "builds": {
        "baseline": "native",
        "candidate": "external"
      },
      "conversion_costs_included": true,
      "decoder": null
    },
    {
      "cell_id": "nr-bg1-n1320-k1056-gap-native-vs-aff3ct",
      "objective": "comparator-gap",
      "role": "confirmatory",
      "workload": {
        "identity": "nr-llr-derate-bg1-n1320-k1056",
        "size": {
          "base_graph": 1,
          "target_n": 1320,
          "target_k": 1056,
          "lifting": 48,
          "full_n": 3264,
          "fillers": 0
        },
        "seed": 305
      },
      "metric_kind": "whole-consumer",
      "scaling": "single-core-latency",
      "core_arm": "single-core",
      "workers": {
        "declared": 1,
        "nested_pools_allowed": false
      },
      "cache_state": "warm",
      "builds": {
        "baseline": "native",
        "candidate": "external"
      },
      "conversion_costs_included": true,
      "decoder": null
    },
    {
      "cell_id": "nr-bg1-n2560-k2048-gap-native-vs-aff3ct",
      "objective": "comparator-gap",
      "role": "confirmatory",
      "workload": {
        "identity": "nr-llr-derate-bg1-n2560-k2048",
        "size": {
          "base_graph": 1,
          "target_n": 2560,
          "target_k": 2048,
          "lifting": 96,
          "full_n": 6528,
          "fillers": 64
        },
        "seed": 306
      },
      "metric_kind": "whole-consumer",
      "scaling": "single-core-latency",
      "core_arm": "single-core",
      "workers": {
        "declared": 1,
        "nested_pools_allowed": false
      },
      "cache_state": "warm",
      "builds": {
        "baseline": "native",
        "candidate": "external"
      },
      "conversion_costs_included": true,
      "decoder": null
    },
    {
      "cell_id": "nr-bg1-n2560-k2048-control-portable-vs-native",
      "objective": "comparator-gap",
      "role": "confirmatory",
      "workload": {
        "identity": "nr-llr-derate-bg1-n2560-k2048",
        "size": {
          "base_graph": 1,
          "target_n": 2560,
          "target_k": 2048,
          "lifting": 96,
          "full_n": 6528,
          "fillers": 64
        },
        "seed": 306
      },
      "metric_kind": "whole-consumer",
      "scaling": "single-core-latency",
      "core_arm": "single-core",
      "workers": {
        "declared": 1,
        "nested_pools_allowed": false
      },
      "cache_state": "warm",
      "builds": {
        "baseline": "conservative-portable",
        "candidate": "native"
      },
      "conversion_costs_included": true,
      "decoder": null
    }
  ]
}
